| № п/п | Раздел | Страница | Описание | HTTP-метод | URL | Комментарий |

| 1 | auth | login | Выполнение авторизации пользователя | POST | login |
| 2 | auth | signup | Регистрация нового пользователя на сайте | POST | signup |
| 3 | auth | forgot password | Ввод email для восстановления пароля | POST | forgot-password | В форму пользователь вводит майл учетной записи, от которой необходимо восстановить пароль |
| 4 | auth | set password | Ввод нового пароля | POST | set-password | В форму пользователь вводит новый пароль |
| 5 | auth | logout | выход пользователя из учетной записи | POST | logout |

